Scraped_URL,Article,Price,Type,date,Bedrooms,Bathrooms,Surface,Neighborhood,City
https://www.sarouty.ma/fr/recherche?c=2&fu=0&ob=mr&page=1&rp=m,"Location magnifique villa vide 420m2 avec piscine Californie, Casablanca",40000,Villa,2025-03-29,4,4,420,Californie,Casablanca
https://www.sarouty.ma/fr/recherche?c=2&fu=0&ob=mr&page=1&rp=m,Bel Appartement En Rez De Jardin - Casablanca Finance City,16000,Appartement,2025-03-29,2,2,195,Casablanca Finance City,Casablanca
https://www.sarouty.ma/fr/recherche?c=2&fu=0&ob=mr&page=1&rp=m,Appartement d'exception à louer meublé,30000,Appartement,2025-03-29,4,3,290,Ain Diab,Casablanca
https://www.sarouty.ma/fr/recherche?c=2&fu=0&ob=mr&page=1&rp=m,SUBLIME APPT MEUBLE EN LOCATION CFC,13000,Appartement,2025-03-29,2,2,90,Casablanca Finance City,Casablanca
https://www.sarouty.ma/fr/recherche?c=2&fu=0&ob=mr&page=1&rp=m,"Appartement à Louer - Maarif, Centre Ville",12500,Appartement,2025-03-29,2,2,120,Maarif,Casablanca
https://www.sarouty.ma/fr/recherche?c=2&fu=0&ob=mr&page=1&rp=m,Villa meublée aux Jardins de l'Océan II,26000,Villa,2025-03-29,4,3,406,Dar Bouazza,Casablanca
https://www.sarouty.ma/fr/recherche?c=2&fu=0&ob=mr&page=1&rp=m,Appartement 2 chambres rdj jardin privatif,9500,Appartement,2025-03-29,2,2,177,Dar Bouazza,Casablanca
https://www.sarouty.ma/fr/recherche?c=2&fu=0&ob=mr&page=1&rp=m,Appartement 2 chambres vue sur mer en résidence,9500,Appartement,2025-03-29,2,1,110,Dar Bouazza,Casablanca
https://www.sarouty.ma/fr/recherche?c=2&fu=0&ob=mr&page=1&rp=m,"Bd ziraoui: Appartement meublé, 2 chambres.",8000,Appartement,2025-03-29,2,2,87,Centre Ville Casablanca,Casablanca
https://www.sarouty.ma/fr/recherche?c=2&fu=0&ob=mr&page=1&rp=m,Villa neuve haut standing à Rabat quartier Souissi,65000,Villa,2025-03-29,5,5,600,Souissi,Rabat
https://www.sarouty.ma/fr/recherche?c=2&fu=0&ob=mr&page=1&rp=m,Belle Villa Meublée en Résidence Fermée,21000,Villa,2025-03-29,3,3,400,Dar Bouazza,Casablanca
https://www.sarouty.ma/fr/recherche?c=2&fu=0&ob=mr&page=1&rp=m,À louer – Villa de luxe à Dar Bouazza,35000,Villa,2025-03-29,3,3,380,Tamaris,Casablanca
https://www.sarouty.ma/fr/recherche?c=2&fu=0&ob=mr&page=1&rp=m,"DAR BOUAZZA, location d’un joli appartement meublé",9500,Appartement,2025-03-29,2,2,112,Dar Bouazza,Casablanca
https://www.sarouty.ma/fr/recherche?c=2&fu=0&ob=mr&page=1&rp=m,Villa neuve de luxe en location à Rabat,60000,Villa,2025-03-29,5,4,570,Souissi,Rabat
https://www.sarouty.ma/fr/recherche?c=2&fu=0&ob=mr&page=1&rp=m,Villa neuve moderne avec piscine à Hay Riad Rabat,33000,Villa,2025-03-29,4,2,380,Hay Riad,Rabat
https://www.sarouty.ma/fr/recherche?c=2&fu=0&ob=mr&page=1&rp=m,Location villa moderne au centre Harhoura,25000,Villa,2025-03-29,3,2,450,Harhoura,Temara
https://www.sarouty.ma/fr/recherche?c=2&fu=0&ob=mr&page=1&rp=m,"Villa de luxe, meublée 3 chambres",22000,Villa,2025-03-29,3,2,190,Dar Bouazza,Casablanca
https://www.sarouty.ma/fr/recherche?c=2&fu=0&ob=mr&page=1&rp=m,Location villa neuve Hay Riad Rabat,40000,Villa,2025-03-29,4,4,400,Hay Riad,Rabat
https://www.sarouty.ma/fr/recherche?c=2&fu=0&ob=mr&page=1&rp=m,Villa meublé moderne en bord de mer,30000,Villa,2025-03-29,5,4,500,Harhoura,Temara
https://www.sarouty.ma/fr/recherche?c=2&fu=0&ob=mr&page=1&rp=m,Appartement 2 chambres vue sur mer en résidence,11000,Appartement,2025-03-29,2,2,110,Dar Bouazza,Casablanca
https://www.sarouty.ma/fr/recherche?c=2&fu=0&ob=mr&page=1&rp=m,Villa d’architecte avec piscine à Rabat,50000,Villa,2025-03-29,5,4,600,Souissi,Rabat
https://www.sarouty.ma/fr/recherche?c=2&fu=0&ob=mr&page=1&rp=m,SPACIEUX APPAREMENT MEUBLE A LA PERLE BLEUE,16000,Appartement,2025-03-29,3,2,145,Quartier Sania,Tanger
https://www.sarouty.ma/fr/recherche?c=2&fu=0&ob=mr&page=1&rp=m,Villa de 2 000 m² à louer sur Souissi à Rabat,55000,Villa,2025-03-29,6,5,2000,Souissi,Rabat
https://www.sarouty.ma/fr/recherche?c=2&fu=0&ob=mr&page=1&rp=m,Villa front golf a louer Bouskoura ville verte,32000,Villa,2025-03-29,4,3,640,Casa Green Town,Bouskoura
https://www.sarouty.ma/fr/recherche?c=2&fu=0&ob=mr&page=1&rp=m,Villa neuve vue sur mer Harhoura-Rabat,30000,Villa,2025-03-29,3,2,400,Harhoura,Temara
https://www.sarouty.ma/fr/recherche?c=2&fu=0&ob=mr&page=1&rp=m,Villa de 1 000 m² à louer sur Hay Riad à Rabat,45000,Villa,2025-03-29,5,6,1000,Hay Riad,Rabat
https://www.sarouty.ma/fr/recherche?c=2&fu=0&ob=mr&page=2&rp=m,Ghauthier location studio terrasse sans vis-à-vis,7000,Appartement,2025-03-29,1,1,86,Gauthier,Casablanca
https://www.sarouty.ma/fr/recherche?c=2&fu=0&ob=mr&page=2&rp=m,Appartement meublé de charme à la Palmeraie,12000,Appartement,2025-03-29,2,1,107,Palmeraie,Marrakech
https://www.sarouty.ma/fr/recherche?c=2&fu=0&ob=mr&page=2&rp=m,Superbe villa proche de Descartes Rabat,38000,Villa,2025-03-29,6,4,360,Souissi,Rabat
https://www.sarouty.ma/fr/recherche?c=2&fu=0&ob=mr&page=2&rp=m,Appartement spacieux avec vue sur mer,12400,Appartement,2025-03-29,3,2,189,Bella Vista,Tanger
https://www.sarouty.ma/fr/recherche?c=2&fu=0&ob=mr&page=2&rp=m,À Louer : Élégante Villa BOUSKOURA VILLE VERTE,22000,Villa,2025-03-29,3,2,341,Casa Green Town,Bouskoura
https://www.sarouty.ma/fr/recherche?c=2&fu=0&ob=mr&page=2&rp=m,villa haut standing à Rabat au quartier Souissi,40000,Villa,2025-03-29,4,4,600,Souissi,Rabat
https://www.sarouty.ma/fr/recherche?c=2&fu=0&ob=mr&page=2&rp=m,Magnifique villa de standing à 3mn de la plage,29500,Villa,2025-03-29,6,3,800,Skhirat plage,Skhirat
https://www.sarouty.ma/fr/recherche?c=2&fu=0&ob=mr&page=2&rp=m,Bel appartement ensoleillé à louer Ain diab,15000,Appartement,2025-03-29,3,3,250,Ain Diab,Casablanca
https://www.sarouty.ma/fr/recherche?c=2&fu=0&ob=mr&page=2&rp=m,Très belle villa meublée avec jardin à Rabat Hay Riad,23000,Villa,2025-03-29,4,2,400,Hay Riad,Rabat
https://www.sarouty.ma/fr/recherche?c=2&fu=0&ob=mr&page=2&rp=m,À Louer – Appartement Neuf de Standing à Jnane Souissi,22000,Appartement,2025-03-29,3,2,170,Souissi,Rabat
https://www.sarouty.ma/fr/recherche?c=2&fu=0&ob=mr&page=2&rp=m,À Louer : Magnifique Villa meublée Bouskoura Ville verte,23000,Villa,2025-03-29,3,2,350,Casa Green Town,Bouskoura
https://www.sarouty.ma/fr/recherche?c=2&fu=0&ob=mr&page=2&rp=m,À Louer : Appartement de Prestige avec Vue Exceptionnelle,12500,Appartement,2025-03-29,4,4,160,Bouskoura Golf City,Bouskoura
https://www.sarouty.ma/fr/recherche?c=2&fu=0&ob=mr&page=2&rp=m,Villa moderne meublée en plein Bouskoura - résidence fermée,25000,Villa,2025-03-29,3,2,350,Casa Green Town,Bouskoura
https://www.sarouty.ma/fr/recherche?c=2&fu=0&ob=mr&page=2&rp=m,Découvrez Notre appartement en Rez-de-Jardin meublé à Louer,15000,Appartement,2025-03-29,2,2,140,Casa Green Town,Bouskoura
https://www.sarouty.ma/fr/recherche?c=2&fu=0&ob=mr&page=2&rp=m,Magnifique Villa à louer vide en plein Bouskoura ville verte,21000,Villa,2025-03-29,3,2,350,Casa Green Town,Bouskoura
https://www.sarouty.ma/fr/recherche?c=2&fu=0&ob=mr&page=2&rp=m,Superbe Appartement en Rez-de-Jardin à Bouskoura ville verte,11000,Appartement,2025-03-29,2,2,170,Casa Green Town,Bouskoura
https://www.sarouty.ma/fr/recherche?c=2&fu=0&ob=mr&page=2&rp=m,Superbe Appartement en Rez-de-Jardin à Bouskoura ville verte,11000,Appartement,2025-03-29,2,2,170,Bouskoura Golf City,Bouskoura
https://www.sarouty.ma/fr/recherche?c=2&fu=0&ob=mr&page=2&rp=m,À louer : Charmant appartement avec grande terrasse à Bouskoura,13000,Appartement,2025-03-29,2,2,86,Casa Green Town,Bouskoura
https://www.sarouty.ma/fr/recherche?c=2&fu=0&ob=mr&page=2&rp=m,"Appartement neuf avec terrasse, Ain Diab",17000,Appartement,2025-03-29,3,3,170,Ain Diab,Casablanca
https://www.sarouty.ma/fr/recherche?c=2&fu=0&ob=mr&page=2&rp=m,LOCATION VILLA MEUBLÉE VILLE VERTE FRONT GOLF,40000,Villa,2025-03-29,4,4,600,Bouskoura,Casablanca
https://www.sarouty.ma/fr/recherche?c=2&fu=0&ob=mr&page=2&rp=m,Villa neuve et moderne avec chauffage central et piscine à Souissi,50000,Villa,2025-03-29,4,3,600,Souissi,Rabat
https://www.sarouty.ma/fr/recherche?c=2&fu=0&ob=mr&page=2&rp=m,Appartement de 405 m² à Casablanca,30000,Appartement,2025-03-29,2,2,405,Ain Diab,Casablanca
https://www.sarouty.ma/fr/recherche?c=2&fu=0&ob=mr&page=2&rp=m,Villa Cosy & design à Agdal RABAT,25000,Villa,2025-03-29,4,2,350,Agdal,Rabat
https://www.sarouty.ma/fr/recherche?c=2&fu=0&ob=mr&page=2&rp=m,Superbe appartement avec terrasse Agdal,20000,Appartement,2025-03-29,3,3,200,Agdal,Rabat
https://www.sarouty.ma/fr/recherche?c=2&fu=0&ob=mr&page=2&rp=m,Location villa avec piscine à Hay Riad RABAT,28000,Villa,2025-03-29,5,3,450,Hay Riad,Rabat
https://www.sarouty.ma/fr/recherche?c=2&fu=0&ob=mr&page=2&rp=m,VILLA a hay Elfath coté Ecole américaine,18000,Villa,2025-03-29,4,2,280,Hay Al Fath,Rabat
https://www.sarouty.ma/fr/recherche?c=2&fu=0&ob=mr&page=2&rp=m,Mise en location d'un luxueux appartement á Bouskoura ville verte,16000,Appartement,2025-03-29,2,2,130,Bouskoura Golf City,Bouskoura
